title,price
LONDON ALLEY Elk Vintage Brown Men's Leather Wallet.,499.
HORNBULL Wallet for Men | Wallet and Belt combo | Gif Set for Men,949
"Innovative Gifts Personalized Wallet with Name & Charm, Customized Premium Vegan Leather Wallet for Men (Olive)",499.
GETOREE Teak Tan Genuine Leather RFID Wallets for Men I 6 Credit/Debit Card Slots I 2 Secret compartments I 1 Coin Pocket & 2 Currency Compartments,580.
"URBAN FOREST Oliver Black Leather Wallet for Men, 6 Card Slot",479.
WildHorn Leather Wallet for Men I Ultra Strong Stitching I 6 Credit Card Slots I 2 Currency Compartments I 1 Coin Pocket,299.
WildHorn Green Leather Wallet for Men I 9 Card Slots I 2 Currency & Secret Compartments I 1 Zipper & 3 ID Card Slots,433.
NAPA HIDE Leather Wallet for Men I Handcrafted I Credit/Debit Card Slots I 2 Currency Compartments I 2 Secret Compartments (Tan Crunch),299.
